PMID,OWN,STAT,DCOM,LR,IS,VI,IP,DP,TI,PG,LID,AB,FAU,AU,AUID,AD,LA,PT,DEP,PL,TA,JT,JID,SB,MH,OTO,OT,COIS,EDAT,MHDA,CRDT,PHST,AID,PST,SO,CI,GR,PMC,PMCR,RN,SI,CN,CIN,FIR,IR,EIN,TT,MID,RIN
25763849,NLM,MEDLINE,20170428,20240111,1433-7347 (Electronic) 0942-2056 (Linking),24,9,2016 Sep,Arthroscopic single-bundle anterior cruciate ligament reconstruction with six-strand hamstring tendon allograft versus bone-patellar tendon-bone allograft.,2915-2922,10.1007/s00167-015-3569-9 [doi],"PURPOSE: The aim of this study was to compare the clinical outcomes of arthroscopic single-bundle anterior cruciate ligament (ACL) reconstruction with six-strand hamstring tendon (HT) allograft versus bone-patellar tendon-bone (BPTB) allograft. METHODS: The prospective randomized controlled trial was included 129 patients. Sixty-nine patients received reconstruction with six-strand HT allografts (HT group), whereas 60 patients with BPTB allografts (BPTB group). Outcome assessment included re-rupture findings, International Knee Documentation Committee (IKDC) scores, Lysholm scores, KT-1000 arthrometer, Lachman test, pivot-shift test, range of motion (ROM) and single-leg hop test. RESULTS: At a mean follow-up of 52 months, 113 patients (HT group, 61 patients; BPTB group, 52 patients) completed a minimum 4-year follow-up. Four patients in HT group and six in BPTB group experienced ACL re-rupture (6.2 vs. 10.3 %) and received revision surgery. Significant between-group differences were observed in KT-1000 outcomes and pivot-shift test 1 (1.2 +/- 1.5 vs. 1.8 +/- 1.3, p = 0.025; positive rate 6.5 vs. 18.9 %, p = 0.036), 2 (1.1 +/- 1.4 vs. 1.6 +/- 1.2, p = 0.044; 8.1 vs. 20.7 %, p = 0.039), 4 (1.1 +/- 1.5 vs. 1.7 +/- 1.4, p = 0.031; 9.7 vs. 25 %, p = 0.012) years postoperatively. The outcomes between the two groups were comparable in terms of IKDC scores, Lysholm scores, Lachman test, ROM and single-leg hop test. CONCLUSIONS: Six-strand HT allograft achieved superior anteroposterior and rotational stability after single-bundle ACL reconstruction. It is a reasonable graft substitute for ACL reconstruction. LEVEL OF EVIDENCE: II.","Dai, Chengliang, Wang, Fei, Wang, Xiaomeng, Wang, Ruipeng, Wang, Shengjie, Tang, Shiyu","Dai C, Wang F, Wang X, Wang R, Wang S, Tang S",,"Department of Joint Surgery, Third Hospital of Hebei Medical University, 139 Ziqiang Road, Shijiazhuang, 050051, Hebei, People's Republic of China., Department of Joint Surgery, Third Hospital of Hebei Medical University, 139 Ziqiang Road, Shijiazhuang, 050051, Hebei, People's Republic of China. wangfeimedical@126.com., Department of Joint Surgery, Third Hospital of Hebei Medical University, 139 Ziqiang Road, Shijiazhuang, 050051, Hebei, People's Republic of China., Department of Joint Surgery, Third Hospital of Hebei Medical University, 139 Ziqiang Road, Shijiazhuang, 050051, Hebei, People's Republic of China., Department of Joint Surgery, Third Hospital of Hebei Medical University, 139 Ziqiang Road, Shijiazhuang, 050051, Hebei, People's Republic of China., Department of Joint Surgery, Third Hospital of Hebei Medical University, 139 Ziqiang Road, Shijiazhuang, 050051, Hebei, People's Republic of China.",eng,"Journal Article, Randomized Controlled Trial",20150313,Germany,Knee Surg Sports Traumatol Arthrosc,"Knee surgery, sports traumatology, arthroscopy : official journal of the ESSKA",9314730,IM,"Adult, *Allografts, Anterior Cruciate Ligament/surgery, Anterior Cruciate Ligament Injuries/*surgery, Anterior Cruciate Ligament Reconstruction/*methods, *Arthroscopy, Bone and Bones/surgery, Bone-Patellar Tendon-Bone Grafting/*methods, Female, Follow-Up Studies, Hamstring Tendons/*surgery, Humans, Joint Instability/surgery, Knee Joint/surgery, Male, Middle Aged, Outcome Assessment, Health Care, Patellar Ligament/surgery, Prospective Studies, Range of Motion, Articular, Reoperation, Rupture/surgery, Tendons/transplantation, Transplantation, Autologous, Transplantation, Homologous, Treatment Outcome, Young Adult",NOTNLM,"Allograft, Anterior cruciate ligament, Bone-patellar tendon-bone, Hamstring tendon, Single-bundle reconstruction",,2015/03/13 06:00,2017/04/30 06:00,2015/03/13 06:00,"2014/07/30 00:00 [received], 2015/03/03 00:00 [accepted], 2015/03/13 06:00 [entrez], 2015/03/13 06:00 [pubmed], 2017/04/30 06:00 [medline]","10.1007/s00167-015-3569-9 [pii], 10.1007/s00167-015-3569-9 [doi]",ppublish,Knee Surg Sports Traumatol Arthrosc. 2016 Sep;24(9):2915-2922. doi: 10.1007/s00167-015-3569-9. Epub 2015 Mar 13.,,,,,,,,,,,,,,
25646363,NLM,MEDLINE,20151123,20150501,1552-3365 (Electronic) 0363-5465 (Linking),43,5,2015 May,Effect of posterolateral bundle graft fixation angles on clinical outcomes in double-bundle anterior cruciate ligament reconstruction: a randomized controlled trial.,1157-64,10.1177/0363546514567069 [doi],"BACKGROUND: In double-bundle (DB) anterior cruciate ligament (ACL) reconstruction, no consensus exists on an optimal setting for the posterolateral bundle (PLB) graft fixation angles. HYPOTHESIS: Different PLB fixation angles would affect clinical outcomes in DB ACL reconstruction. STUDY DESIGN: Randomized controlled trial; Level of evidence, 1. METHODS: This study prospectively included 90 patients who underwent primary DB ACL reconstruction with an autologous semitendinosus tendon. The PLB fixation angles were randomly set as follows: 0 degrees  of flexion (P0; n=30), 20 degrees  (P20; n=30), and 45 degrees  (P45; n=30). In all groups, the anteromedial bundle was fixed at 20 degrees  of flexion. The following evaluation methods were used at the preoperative period and at 3, 6, and 9 months and 1 and 2 years after the surgery: clinical examination, KT-1000 arthrometer measurement, muscle strength, Tegner score, Lysholm score, and subjective rating scale regarding patient satisfaction and sports performance levels. Graft retear, contralateral ACL tear, and additional meniscus surgery were also recorded. RESULTS: Seventy-five patients (P0, n=25; P20, n=26; P45, n=24) who were followed for 2 years were evaluated. Preoperatively, there were no differences among the groups. Postoperatively, pivot-shift test results in the P0 and P20 groups were better than those in the P45 group (P0, n=23 graded negative and 2 graded 1+; P20, n=23 and 2; P45, n=15 and 7, respectively; P0 vs P45: P=.038 and P20 vs P45: P=.038). Average KT-1000 arthrometer laxity measurements were better in the P20 group than in the P45 group (P0, 0.4 mm; P20, 0.3 mm; P45, 1.3 mm; P20 vs P45: P=.048), and there were more patients with graft failure (KT-1000 measurement, >/=4 mm) in the P45 group (n=3) than the P0 and P20 groups (each, n=0). There were no significant differences in range of motion, other laxity tests, muscle strength, Tegner score, Lysholm score, subjective rating scale, or additional surgery. CONCLUSION: In DB ACL reconstruction, when the anteromedial bundle was fixed at 20 degrees  of flexion, fixation of the PLB at 45 degrees  was worse than fixation at 0 degrees  and 20 degrees with respect to anterior and rotational stability during the 2-year follow-up. KT-1000 arthrometer measurements and pivot-shift test results were significantly worse, and there were more patients with graft failure in the P45 group. There were no differences among groups in other findings.","Koga, Hideyuki, Muneta, Takeshi, Yagishita, Kazuyoshi, Watanabe, Toshifumi, Mochizuki, Tomoyuki, Horie, Masafumi, Nakamura, Tomomasa, Otabe, Koji, Sekiya, Ichiro","Koga H, Muneta T, Yagishita K, Watanabe T, Mochizuki T, Horie M, Nakamura T, Otabe K, Sekiya I",,"Department of Orthopaedic Surgery, Tokyo Medical and Dental University Hospital of Medicine, Tokyo, Japan koga.orj@tmd.ac.jp koga-z@rg7.so-net.ne.jp., Department of Orthopaedic Surgery, Tokyo Medical and Dental University Hospital of Medicine, Tokyo, Japan., Department of Orthopaedic Surgery, Tokyo Medical and Dental University Hospital of Medicine, Tokyo, Japan., Department of Orthopaedic Surgery, Tokyo Medical and Dental University Hospital of Medicine, Tokyo, Japan., Department of Orthopaedic Surgery, Tokyo Medical and Dental University Hospital of Medicine, Tokyo, Japan., Department of Orthopaedic Surgery, Tokyo Medical and Dental University Hospital of Medicine, Tokyo, Japan., Department of Orthopaedic Surgery, Tokyo Medical and Dental University Hospital of Medicine, Tokyo, Japan., Department of Orthopaedic Surgery, Tokyo Medical and Dental University Hospital of Medicine, Tokyo, Japan., Department of Orthopaedic Surgery, Tokyo Medical and Dental University Hospital of Medicine, Tokyo, Japan.",eng,"Journal Article, Randomized Controlled Trial",20150202,United States,Am J Sports Med,The American journal of sports medicine,7609541,IM,"Adolescent, Adult, Anterior Cruciate Ligament/*surgery, Anterior Cruciate Ligament Reconstruction/*methods, Female, Follow-Up Studies, Humans, Joint Instability/surgery, Male, Middle Aged, Muscle Strength/physiology, Prospective Studies, Range of Motion, Articular/physiology, Tendons/*transplantation, Transplants, Young Adult",NOTNLM,"anterior cruciate ligament reconstruction, double bundle, graft fixation angle, randomized controlled trial",,2015/02/04 06:00,2015/12/15 06:00,2015/02/04 06:00,"2015/02/04 06:00 [entrez], 2015/02/04 06:00 [pubmed], 2015/12/15 06:00 [medline]","0363546514567069 [pii], 10.1177/0363546514567069 [doi]",ppublish,Am J Sports Med. 2015 May;43(5):1157-64. doi: 10.1177/0363546514567069. Epub 2015 Feb 2.,(c) 2015 The Author(s).,,,,,,,,,,,,,
25514139,NLM,MEDLINE,20160321,20220317,1536-3724 (Electronic) 1050-642X (Linking),25,4,2015 Jul,"A Randomized Clinical Trial Comparing Patellar Tendon, Hamstring Tendon, and Double-Bundle ACL Reconstructions: Patient-Reported and Clinical Outcomes at a Minimal 2-Year Follow-up.",321-31,10.1097/JSM.0000000000000165 [doi],"OBJECTIVE: To compare 3 anatomically positioned autografts for anterior cruciate ligament (ACL) reconstruction, by measuring patient-reported disease-specific quality of life at 2 years postoperatively. DESIGN: Double-blinded, randomized clinical trial with intraoperative computer-generated treatment allocation. Patients and an independent trained evaluator were blinded. SETTING: University-based orthopedic referral practice. PATIENTS: Three hundred thirty patients (14-50 years; 183 male patients) with isolated ACL deficiency were equally randomized to: (1) patellar tendon, PT: 28.7 years (SD = 9.7); (2) quadruple-stranded hamstring tendon, HT: 28.5 years (SD = 9.9); and (3) double bundle using HT, DB: 28.3 years (SD = 9.8); 322 patients completed 2-year follow-up. INTERVENTION: Anterior cruciate ligament reconstruction using PT, HT, or DB autografts. MAIN OUTCOME MEASURES: Measured at baseline, 1 and 2 years postoperatively-primary: anterior cruciate ligament quality-of-life scores; secondary: International Knee Documentation Committee (IKDC) scores, KT-1000 arthrometer, pivot shift, range of motion, Tegner activity, Cincinnati Occupational Scale, and single-leg hop. Proportions of correct graft type guesses by the patients and evaluator assessed blinding effectiveness. RESULTS: Baseline characteristics were not different. Anterior cruciate ligament quality-of-life scores increased over time for all groups (P = 0.001) but were not different at 2 years (P = 0.591): PT = 84.6 (SD = 16.6, 95% confidence interval [CI] = 81.4-87.8), HT = 82.5 (SD = 17.7, 95% CI = 79.2-85.9), and DB = 82.4 (SD = 17.5, 95% CI = 79.1-85.7). Two-year KT-1000 side-to-side differences (PT = 1.86 mm; HT = 2.97 mm; DB = 2.65 mm) were statistically significant between PT-HT (P = 0.002) and PT-DB (P = 0.044). The remaining secondary outcomes were not statistically different. Correct graft type guesses occurred 51% of the time for patients and 46% for the evaluator. CONCLUSIONS: Two-year disease-specific quality-of-life outcome was not different between the ACL reconstruction techniques. The PT reconstructions had significantly lower side-to-side differences on static stability measures. Patient and evaluator blinding was achieved. LEVEL OF EVIDENCE: Level 1 (Therapeutic Studies). CLINICAL RELEVANCE: This high-quality, large, double-blind randomized clinical trial (RCT) addresses the insufficient evidence in the literature comparing PT, single-bundle hamstring, and DB hamstring reconstructions for ACL rupture in adults. In addition to the clinical and functional results, this RCT uniquely reports on the disease-specific, patient-reported quality-of-life outcome at 2 years postoperatively.","Mohtadi, Nicholas, Chan, Denise, Barber, Rhamona, Oddone Paolucci, Elizabeth","Mohtadi N, Chan D, Barber R, Oddone Paolucci E",,"*Sport Medicine Centre, University of Calgary, Calgary, Alberta; daggerDepartment of Surgery, Faculty of Medicine and the Sport Medicine Centre, University of Calgary, Calgary, Alberta; and double daggerDepartments of Surgery & Community Health Sciences, Faculty of Medicine, Health Sciences Centre. Foothills Campus, University of Calgary, Calgary, Alberta.",eng,"Comparative Study, Journal Article, Randomized Controlled Trial",,United States,Clin J Sport Med,Clinical journal of sport medicine : official journal of the Canadian Academy of Sport Medicine,9103300,IM,"Adolescent, Adult, *Anterior Cruciate Ligament Injuries, Anterior Cruciate Ligament Reconstruction/*methods, Double-Blind Method, Female, Humans, Knee Joint/*surgery, Ligaments, Articular/transplantation, Male, Middle Aged, Muscle, Skeletal, Patellar Ligament/*transplantation, Quality of Life, Range of Motion, Articular, Thigh, Transplantation, Autologous, Treatment Outcome, Young Adult",,,,2014/12/17 06:00,2016/03/22 06:00,2014/12/17 06:00,"2014/12/17 06:00 [entrez], 2014/12/17 06:00 [pubmed], 2016/03/22 06:00 [medline]",10.1097/JSM.0000000000000165 [doi],ppublish,Clin J Sport Med. 2015 Jul;25(4):321-31. doi: 10.1097/JSM.0000000000000165.,,,,,,,,,,,,,,
25242512,NLM,MEDLINE,20150508,20181202,1526-3231 (Electronic) 0749-8063 (Linking),31,1,2015 Jan,Mid- to long-term results of single-bundle versus double-bundle anterior cruciate ligament reconstruction: randomized controlled trial.,69-76,S0749-8063(14)00644-6 [pii] 10.1016/j.arthro.2014.07.020 [doi],"PURPOSE: To evaluate the mid-to long-term results of a randomized controlled trial of single-bundle (SB) versus double-bundle (DB) anterior cruciate ligament (ACL) reconstruction using a semitendinosus tendon. METHODS: Seventy-eight patients who underwent primary ACL reconstruction with an autologous semitendinosus tendon were prospectively randomized into 2 groups: SB reconstruction (n = 39) and DB reconstruction (n = 39). In both groups, grafts were fixed at 30 degrees  of flexion with a total tension of 80 N. The following evaluation methods were used: clinical examination, KT-1000 arthrometer (MEDmetric, San Diego, CA) measurement, muscle strength, Tegner activity score, Lysholm score, subjective rating scale regarding patient satisfaction and sports performance level, graft retear, contralateral ACL tear, and additional meniscus surgery. RESULTS: Fifty-three patients (25 in SB group and 28 in DB group) who were followed up for a minimum of 3 years (mean, 69 months; range, 36 to 140 months) were evaluated. Preoperatively, there were no differences between the groups. Postoperatively, the Lachman and pivot-shift test results were better in the DB group (P = .024 and P < .0001, respectively). KT measurements were better in the DB group (mean, 1.4 mm v 2.7 mm; P = .0023). The Tegner score was also better in the DB group (P = .033). There were no significant differences in range of motion, muscle strength, Lysholm score, subjective rating scale, graft retear, and secondary meniscal tear. CONCLUSIONS: In ACL reconstruction using the transtibial approach, DB reconstruction was significantly better than SB reconstruction regarding anterior and rotational stability during the 3- to 12-year follow-up. The results of KT measurements and the Lachman and pivot-shift tests were significantly better in the DB group, whereas there was no difference in the anterior drawer test results. The Tegner score was also better in the DB group; however, there were no differences in the other subjective findings. LEVEL OF EVIDENCE: Level II, lesser-quality prospective randomized trial.","Koga, Hideyuki, Muneta, Takeshi, Yagishita, Kazuyoshi, Watanabe, Toshifumi, Mochizuki, Tomoyuki, Horie, Masafumi, Nakamura, Tomomasa, Otabe, Koji, Sekiya, Ichiro","Koga H, Muneta T, Yagishita K, Watanabe T, Mochizuki T, Horie M, Nakamura T, Otabe K, Sekiya I",,"Department of Orthopaedic Surgery, Tokyo Medical and Dental University Hospital of Medicine, Tokyo, Japan. Electronic address: koga.orj@tmd.ac.jp., Department of Orthopaedic Surgery, Tokyo Medical and Dental University Hospital of Medicine, Tokyo, Japan., Department of Orthopaedic Surgery, Tokyo Medical and Dental University Hospital of Medicine, Tokyo, Japan., Department of Orthopaedic Surgery, Tokyo Medical and Dental University Hospital of Medicine, Tokyo, Japan., Department of Orthopaedic Surgery, Tokyo Medical and Dental University Hospital of Medicine, Tokyo, Japan., Department of Orthopaedic Surgery, Tokyo Medical and Dental University Hospital of Medicine, Tokyo, Japan., Department of Orthopaedic Surgery, Tokyo Medical and Dental University Hospital of Medicine, Tokyo, Japan., Department of Orthopaedic Surgery, Tokyo Medical and Dental University Hospital of Medicine, Tokyo, Japan., Department of Orthopaedic Surgery, Tokyo Medical and Dental University Hospital of Medicine, Tokyo, Japan.",eng,"Journal Article, Randomized Controlled Trial",20140918,United States,Arthroscopy,Arthroscopy : the journal of arthroscopic & related surgery : official publication of the Arthroscopy Association of North America and the International Arthroscopy Association,8506498,IM,"Adolescent, Adult, Anterior Cruciate Ligament/surgery, Anterior Cruciate Ligament Reconstruction/*methods, Female, Humans, Joint Instability/diagnosis, Male, Middle Aged, Muscle Strength/physiology, Physical Examination, Prospective Studies, Range of Motion, Articular/physiology, Tendons/*transplantation, Tibial Meniscus Injuries, Treatment Outcome, Young Adult",,,,2014/09/23 06:00,2015/05/09 06:00,2014/09/23 06:00,"2014/04/26 00:00 [received], 2014/07/11 00:00 [revised], 2014/07/11 00:00 [accepted], 2014/09/23 06:00 [entrez], 2014/09/23 06:00 [pubmed], 2015/05/09 06:00 [medline]","S0749-8063(14)00644-6 [pii], 10.1016/j.arthro.2014.07.020 [doi]",ppublish,Arthroscopy. 2015 Jan;31(1):69-76. doi: 10.1016/j.arthro.2014.07.020. Epub 2014 Sep 18.,"Copyright (c) 2015 Arthroscopy Association of North America. Published by Elsevier, Inc. All rights reserved.",,,,,,,,,,,,,
25192689,NLM,MEDLINE,20160215,20220409,1432-5195 (Electronic) 0341-2695 (Linking),39,3,2015 Mar,Anterior cruciate ligament reconstruction and return to sport activity: postural control as the key to success.,527-34,10.1007/s00264-014-2513-9 [doi],"PURPOSE: The risk for re-tear following anterior cruciate ligament (ACL) reconstruction is influenced by several hormonal, neuromuscular, biomechanical and anatomic factors. One of the most important negative prognostic factors that markedly increase the risk for ACL re-tear is the presence of high knee-abduction moment (KAM), which can be measured immediately by landing on both feet after a vertical jump. We evaluated the effect in postoperative values for KAM according to the type of graft used for ACL reconstruction (hamstring vs patellar tendon) and a specific rehabilitation protocol focusing on recovery of muscular strength, proprioception and joint stabilisation. METHODS: From November 2010 to September 2012, we enrolled 40 female recreational athletes with clinical and imaging evidence of ACL tear and randomised them in two groups. One group of patients underwent reconstruction with a hamstring-tendon graft and the second with a patellar-tendon graft. A custom rehabilitation programme focusing on proprioception was adopted. Clinical outcomes [International Knee Documentation Committee (IKDC) and Lysholm scores] and performance in functional test for stability (single-leg hop, timed hop, crossover triple hop, KAM test) were assessed preoperatively at three and six months postoperatively. RESULTS: All patients showed statistically significant clinical improvements postoperatively when compared with preoperative values (P < 0.0001). No significant intergroup difference was observed in all clinical scores and functional tests, with the exception of the value registered for the KAM test (P < 0.0001). CONCLUSIONS: ACL reconstruction using patellar-tendon graft followed by rehabilitation centred on strength, proprioception and stability restoration can produce satisfactory values for KAM within the physiological range. The surgical strategies should be adapted to the patient on the basis of a multidisciplinary approach.","Papalia, Rocco, Franceschi, Francesco, Tecame, Andrea, D'Adamio, Stefano, Maffulli, Nicola, Denaro, Vincenzo","Papalia R, Franceschi F, Tecame A, D'Adamio S, Maffulli N, Denaro V",,"Department of Orthopaedic and Trauma Surgery, Campus Bio-Medico University of Rome, Via Alvaro del Portillo 200, Rome, Italy.",eng,"Journal Article, Randomized Controlled Trial",20140906,Germany,Int Orthop,International orthopaedics,7705431,IM,"Adolescent, Anterior Cruciate Ligament/surgery, Anterior Cruciate Ligament Reconstruction/*methods/rehabilitation, Female, Humans, Muscle Strength, Muscle, Skeletal/transplantation, Patellar Ligament/transplantation, *Return to Sport, Rupture/surgery, Young Adult",,,,2014/09/07 06:00,2016/02/16 06:00,2014/09/07 06:00,"2014/08/03 00:00 [received], 2014/08/14 00:00 [accepted], 2014/09/07 06:00 [entrez], 2014/09/07 06:00 [pubmed], 2016/02/16 06:00 [medline]",10.1007/s00264-014-2513-9 [doi],ppublish,Int Orthop. 2015 Mar;39(3):527-34. doi: 10.1007/s00264-014-2513-9. Epub 2014 Sep 6.,,,,,,,,,,,,,,
24825597,NLM,MEDLINE,20151123,20211021,1613-7671 (Electronic) 0043-5325 (Linking),126,13-14,2014 Jul,Primary anterior cruciate ligament reconstruction in athletes: a 5-year follow up comparing patellar tendon versus hamstring tendon autograft.,397-402,10.1007/s00508-014-0550-4 [doi],"INTRODUCTION: ACL reconstruction with quadruple hamstring graft (HT) as well as bone-patellar tendon-bone autograft (PT) is a frequent procedure in athletes after ACL rupture. Both techniques are reported to provide for satisfying results but only few articles compare both techniques. MATERIAL AND METHODS: Prospective evaluation was performed on 96 patients with isolated ACL rupture undergoing reconstruction with a HT or PT autograft by a single surgeon at our institution. Long time follow-up after five years included the IKDC and KOOS evaluation form as well as clinical assessment (ROM, Lachmann testing, KT-2000). RESULTS: Comparing both methods revealed no significant differences regarding IKDC and KOOS. The KT-2000 arthrometer testing showed a slightly increased mean laxity in the HT group. There were no differences regarding harvest side symptoms comparing HT and PT as well as one and two incision technique. Kneeling pain was significantly less common after HT autograft. HT as well as PT autograft achieve equally good clinical results in athletes at five year follow-up with no significant difference regarding knee stability. Although no difference concerning the harvest site was identified, HT seems to be favorable for patients who work in a kneeling position.","Leitgeb, Johannes, Kottstorfer, Julia, Schuster, Rupert, Kovar, Florian M, Platzer, Patrick, Aldrian, Silke","Leitgeb J, Kottstorfer J, Schuster R, Kovar FM, Platzer P, Aldrian S",,"Department of Trauma Surgery, Medical University of Vienna, Waehringer Guertel 18-20, 1090, Wien, Austria, johannes.leitgeb@meduniwien.ac.at.",eng,"Comparative Study, Journal Article, Randomized Controlled Trial",20140514,Austria,Wien Klin Wochenschr,Wiener klinische Wochenschrift,21620870R,IM,"Adolescent, Adult, *Anterior Cruciate Ligament Injuries, Anterior Cruciate Ligament Reconstruction/*methods, Arthrometry, Articular, Arthroscopy/*methods, Athletic Injuries/*surgery, Female, Follow-Up Studies, Humans, Joint Instability/etiology, Male, Postoperative Complications/*etiology, Prospective Studies, Rupture, Tendons/*transplantation, Tissue and Organ Harvesting, Transplant Donor Site, Young Adult",,,,2014/05/16 06:00,2015/12/15 06:00,2014/05/15 06:00,"2014/01/16 00:00 [received], 2014/04/13 00:00 [accepted], 2014/05/15 06:00 [entrez], 2014/05/16 06:00 [pubmed], 2015/12/15 06:00 [medline]",10.1007/s00508-014-0550-4 [doi],ppublish,Wien Klin Wochenschr. 2014 Jul;126(13-14):397-402. doi: 10.1007/s00508-014-0550-4. Epub 2014 May 14.,,,,,,,,,,,"Wien Klin Wochenschr. 2014 Jul;126(13-14):455. Koettsdorfer, Julia [corrected to, Kottstorfer, Julia]",,,
