PMID,OWN,STAT,DCOM,LR,IS,VI,IP,DP,TI,PG,LID,AB,FAU,AU,AUID,AD,LA,PT,DEP,PL,TA,JT,JID,SB,MH,OTO,OT,COIS,EDAT,MHDA,CRDT,PHST,AID,PST,SO,CI,GR,PMC,PMCR,RN,SI,CN,CIN,FIR,IR,EIN,TT,MID,RIN
40476596,NLM,MEDLINE,20250716,20250723,1552-3365 (Electronic) 0363-5465 (Linking),53,9,2025 Jul,"Comparable Mid- to Long-term Outcomes of Semitendinosus and Semitendinosus/Gracilis Grafts in ACL Reconstruction: Median 8-Year (Range, 5-10 Years) Results From a Randomized Controlled Study.",2145-2153,10.1177/03635465251344106 [doi],"BACKGROUND: The hamstring tendon autograft used for anterior cruciate ligament reconstruction commonly entails both the semitendinosus and gracilis (ST/G) tendons for sufficient graft thickness, but they may impair function. To mitigate this, a tendon-sparing ST-only graft has been explored. However, less is known of the mid- to long-term outcomes comparing these configurations. PURPOSE/HYPOTHESIS: The purpose was to investigate differences between the quadrupled ST tendon graft and the doubled ST/G graft configuration. The primary hypothesis was that there would be no difference in the International Knee Documentation Committee 2000 Subjective Knee Form (IKDC-SF) outcomes between groups. The secondary hypothesis was that there would be no differences in knee flexion strength, KT-1000 arthrometer side-to-side measurements, or need for secondary surgery (including revision) between the 2 techniques. STUDY DESIGN: Randomized controlled trial; Level of evidence, 1. METHODS: At baseline, 98 patients were randomized to receive either the quadrupled ST tendon graft or the doubled ST/G graft configuration. Preoperatively and after 2 and median 8 years (range, 5-10 years) postoperatively, the investigators collected results for the IKDC-SF, Knee injury and Osteoarthritis Outcome Score, Tegner Activity Scale, a sports and activity participation questionnaire, knee laxity (KT-1000 arthrometer) side-to-side measurements, Lachman test, and flexion rotation drawer test. Need for secondary knee surgery was evaluated 5 to 10 years postoperatively. RESULTS: Seventy-seven patients completed median 8-year follow-up (range, 5-10 years): 38 patients in the ST group and 39 patients in the ST/G group. No statistically significant differences were observed between the ST and ST/G groups in IKDC-SF scores (81.7 vs 82.1; P = .93), knee stability, or revision rates. Both groups demonstrated statistically significant improvements in self-reported function (P < .001) until final follow-up. The overall anterior cruciate ligament revision rate was 10.4%, and no increased risk of graft failure or excessive residual laxity was associated with the ST-only graft. CONCLUSION: No statistically significant differences were found between the ST group and the ST/G group in terms self-reported function, knee laxity, or need for secondary surgery at median 8 years (range, 5-10 years) after surgery. The ST-only graft configuration did not increase the risk of graft failure or excessive residual laxity compared with the ST/G graft configuration.","Mo, Ingunn Fleten, Harlem, Thomas, Faleide, Anne Gro Heyn, Strand, Torbjorn, Vindfeld, Soren, Solheim, Eirik, Randsborg, Per Henrik, Inderhaug, Eivind","Mo IF, Harlem T, Faleide AGH, Strand T, Vindfeld S, Solheim E, Randsborg PH, Inderhaug E",ORCID: 0009-0001-1586-1490,"Haraldsplass Deaconess Hospital, Bergen, Norway., Sports Traumatology and Arthroscopy Research Group, Bergen, Norway., University of Bergen, Bergen, Norway., Haraldsplass Deaconess Hospital, Bergen, Norway., Sports Traumatology and Arthroscopy Research Group, Bergen, Norway., Haraldsplass Deaconess Hospital, Bergen, Norway., Sports Traumatology and Arthroscopy Research Group, Bergen, Norway., University of Bergen, Bergen, Norway., Haraldsplass Deaconess Hospital, Bergen, Norway., Sports Traumatology and Arthroscopy Research Group, Bergen, Norway., Haraldsplass Deaconess Hospital, Bergen, Norway., Sports Traumatology and Arthroscopy Research Group, Bergen, Norway., University of Bergen, Bergen, Norway., Sports Traumatology and Arthroscopy Research Group, Bergen, Norway., University of Bergen, Bergen, Norway., Akershus University Hospital., University of Oslo, Oslo, Norway., Haraldsplass Deaconess Hospital, Bergen, Norway., Sports Traumatology and Arthroscopy Research Group, Bergen, Norway., University of Bergen, Bergen, Norway., Haukeland University Hospital, Bergen, Norway.",eng,"Comparative Study, Journal Article, Randomized Controlled Trial",20250606,United States,Am J Sports Med,The American journal of sports medicine,7609541,IM,"Humans, *Anterior Cruciate Ligament Reconstruction/methods, Male, Female, Adult, *Hamstring Tendons/transplantation, Young Adult, *Anterior Cruciate Ligament Injuries/surgery, Adolescent, Treatment Outcome, Range of Motion, Articular, Knee Joint, Middle Aged, *Tendons/transplantation, Transplantation, Autologous, Reoperation",NOTNLM,"anterior ligament reconstruction, hamstring tendon autograft, orthopaedic surgery, semitendinosus, semitendinosus/gracilis","One or more of the authors has declared the following potential conflict of, interest or source of funding: E.I. and T.H. received travel support and, laboratory access from Arthrex during piloting of the study. AOSSM checks author, disclosures against the Open Payments Database (OPD). AOSSM has not conducted an, independent investigation on the OPD and disclaims any liability or, responsibility relating thereto.",2025/06/06 12:34,2025/07/16 06:25,2025/06/06 07:52,"2025/07/16 06:25 [medline], 2025/06/06 12:34 [pubmed], 2025/06/06 07:52 [entrez]",10.1177/03635465251344106 [doi],ppublish,Am J Sports Med. 2025 Jul;53(9):2145-2153. doi: 10.1177/03635465251344106. Epub 2025 Jun 6.,,,,,,,,,,,,,,
40351242,NLM,MEDLINE,20260128,20260131,1433-7347 (Electronic) 0942-2056 (Print) 0942-2056 (Linking),34,2,2026 Feb,A semitendinosus with adjustable button graft construct in patients undergoing hamstring ACL reconstruction results in improved knee flexor strength symmetry and less donor site pain and morbidity: Outcomes from the DOSTAR randomized controlled trial.,484-493,10.1002/ksa.12698 [doi],"PURPOSE: To compare donor site morbidity and patient-reported outcome measures (PROMs), knee laxity and early strength and functional outcomes, following anterior cruciate ligament reconstruction (ACLR) using a semitendinosus (ST) tendon autograft with suspensory adjustable button tibial fixation or semitendinosus-gracilis (STG) autograft with tibial screw fixation. METHODS: While 153 patients were prospectively recruited and randomized to an ST or STG autograft, 131 (62 ST and 69 STG) were retained following ACLR and followed post-surgery. Standardized surgical techniques were employed, varying only in graft selection and fixation. The primary study outcomes were early hamstring pain, donor site morbidity and strength recovery. However, several outcomes were assessed pre-surgery and at 3 and 6 months, encompassing the Donor-site-related Functional Problems following Anterior Cruciate Ligament Reconstruction (DFPACLR) score, Visual Analogue Scale (VAS) for hamstring pain and other commonly employed PROMs, anteroposterior laxity (KT-1000), isokinetic hamstring and quadriceps strength, hop testing, complications and re-operations. Intention-to-treat analysis was performed using linear mixed models for continuous data and Mann-Whitney U tests where appropriate. RESULTS: At 6 months, ST patients reported significantly lower hamstring pain (p < 0.001) and DFPACLR (p < 0.001) scores. A significantly higher (p < 0.001) peak knee flexor strength limb symmetry index (LSI) was observed for the ST group, though no other group differences in side-to-side laxity, hop tests or other normalized strength measures or LSIs were observed. CONCLUSIONS: ACLR using an ST autograft resulted in less donor site pain and morbidity, and improved knee flexor strength symmetry at 6 months, while demonstrating comparable functional outcomes to the STG autograft. LEVEL OF EVIDENCE: Level 1 prospective, double-blinded, randomized controlled trial.","Lawless, Adam M, Ebert, Jay R, Edwards, Peter K, Malik, Shahbaz S, Davies, Peter S E, D'Alessandro, Peter A","Lawless AM, Ebert JR, Edwards PK, Malik SS, Davies PSE, D'Alessandro PA",ORCID: 0000-0001-5843-6243,"Fiona Stanley and Fremantle Hospitals Group, South Metropolitan Health Service, Perth, Western Australia, Australia., School of Human Sciences (Exercise and Sport Science), University of Western Australia, Perth, Western Australia, Australia., HFRC, Perth, Western Australia, Australia., Orthopaedic Research Foundation of Western Australia, Perth, Western Australia, Australia., Orthopaedic Research Foundation of Western Australia, Perth, Western Australia, Australia., School of Allied Health, Curtin University, Perth, Western Australia, Australia., Worcester Acute Hospitals NHS Trust, Worcester, UK., Fiona Stanley and Fremantle Hospitals Group, South Metropolitan Health Service, Perth, Western Australia, Australia., Orthopaedic Research Foundation of Western Australia, Perth, Western Australia, Australia., Fiona Stanley and Fremantle Hospitals Group, South Metropolitan Health Service, Perth, Western Australia, Australia., Orthopaedic Research Foundation of Western Australia, Perth, Western Australia, Australia., School of Surgery, University of Western Australia, Perth, Western Australia, Australia.",eng,"Journal Article, Randomized Controlled Trial",20250512,Germany,Knee Surg Sports Traumatol Arthrosc,"Knee surgery, sports traumatology, arthroscopy : official journal of the ESSKA",9314730,IM,"Humans, *Anterior Cruciate Ligament Reconstruction/methods, Female, Male, Adult, Young Adult, *Hamstring Tendons/transplantation, Prospective Studies, *Anterior Cruciate Ligament Injuries/surgery, Muscle Strength, Patient Reported Outcome Measures, Postoperative Pain/prevention & control, Transplantation, Autologous, Adolescent, Joint Instability, Transplant Donor Site, Hamstring Muscles, Treatment Outcome, *Tendons/transplantation, Pain Measurement",NOTNLM,"adjustable button, anterior cruciate ligament reconstruction, donor site morbidity, functional outcomes, gracilis, hamstring autograft, semitendinosus","Peter A. D'Alessandro received funding from Smith & Nephew (Research Grant,, Fellow Funding, Travel Support, Education Support).",2025/05/12 06:32,2026/01/28 19:21,2025/05/12 05:14,"2025/04/03 00:00 [revised], 2025/02/04 00:00 [received], 2025/04/05 00:00 [accepted], 2026/01/28 19:21 [medline], 2025/05/12 06:32 [pubmed], 2025/05/12 05:14 [entrez], 2026/01/28 00:00 [pmc-release]","KSA12698 [pii], 10.1002/ksa.12698 [doi]",ppublish,Knee Surg Sports Traumatol Arthrosc. 2026 Feb;34(2):484-493. doi: 10.1002/ksa.12698. Epub 2025 May 12.,"(c) 2025 The Author(s). Knee Surgery, Sports Traumatology, Arthroscopy published by, John Wiley & Sons Ltd on behalf of European Society of Sports Traumatology, Knee, Surgery and Arthroscopy.",IIS887/Smith and Nephew/,PMC12850584,2026/01/28,,,,,,,,,,
40086524,NLM,MEDLINE,20251024,20260127,1526-3231 (Electronic) 0749-8063 (Linking),41,10,2025 Oct,Intraoperative Periarticular Injection May Improve Postoperative Pain Scores and Reduce Opioid Consumption in Arthroscopic Anterior Cruciate Ligament Reconstruction Surgery.,4095-4102,S0749-8063(25)00170-7 [pii] 10.1016/j.arthro.2025.03.014 [doi],"PURPOSE: To evaluate efficacy of an intraoperative periarticular injection (PAI) in improving postoperative outcomes, including pain relief and reducing opioid consumption in patients undergoing arthroscopic anterior cruciate ligament reconstruction (aACLR) with hamstring tendon autograft. METHODS: This prospective, assessor-blinded, two-surgeon clinical trial was conducted from March 20, 2022, to June 20, 2022. A total of 320 patients were initially included, and after screening and exclusions, 300 patients undergoing aACLR were randomized to receive either PAI or were assigned to the nPAI group. Inclusion criteria consisted of patients aged 18 years or older undergoing primary aACLR, with or without a concomitant meniscus procedure for knee instability, who agreed to participate and provided informed consent for randomization into the PAI or nPAI group. The minimum follow-up period was 2 weeks postoperatively. The primary outcome was decreased visual analog scale (VAS) scores and cumulative morphine milligram equivalents (MME). The secondary outcome parameters included decrease in narcotic-related adverse effects. RESULTS: A total of 142 patients in the PAI group and 146 patients in the nPAI group were analyzed. In the PAI group, a lower VAS score at immediate postoperative period and postoperative 4-hour and 24-hour period was observed compared with the nPAI group. Proportions of patients achieving MCID were higher in the PAI group at all time points compared to nPAI. Cumulative morphine consumption was significantly reduced in the PAI group (P < .001). CONCLUSIONS: PAI during aACLR with hamstring autograft significantly improved pain scores and reduced opioid consumption compared to nPAI. Although statistical differences were found, cohort-specific MCID analysis showed a clinically relevant benefit at 24 hours, with 54.2% of the PAI group achieving meaningful pain relief versus 23.3% in the nPAI group. These results suggest that PAI offers time-dependent, patient-specific benefits and supports its role in multimodal analgesia. LEVEL OF EVIDENCE: Level II, randomized controlled trials.","Ma, Hsuan-Hsiao, Chen, Kun-Hui, Chiang, En-Rung, Ma, Hsiao-Li","Ma HH, Chen KH, Chiang ER, Ma HL",,"Department of Orthopaedics and Traumatology, Taipei Veterans General Hospital, Taipei, Taiwan; Department of Surgery, School of Medicine, National Yang Ming Chiao Tung University, Taipei, Taiwan., Department of Orthopaedics and Traumatology, Taipei Veterans General Hospital, Taipei, Taiwan; Department of Surgery, School of Medicine, National Yang Ming Chiao Tung University, Taipei, Taiwan., Department of Orthopaedics and Traumatology, Taipei Veterans General Hospital, Taipei, Taiwan; Department of Surgery, School of Medicine, National Yang Ming Chiao Tung University, Taipei, Taiwan. Electronic address: rondoo0614@gmail.com., Department of Orthopaedics and Traumatology, Taipei Veterans General Hospital, Taipei, Taiwan; Department of Surgery, School of Medicine, National Yang Ming Chiao Tung University, Taipei, Taiwan; Department of Orthopedics, Cheng Hsin General Hospital.",eng,"Journal Article, Randomized Controlled Trial",20250312,United States,Arthroscopy,Arthroscopy : the journal of arthroscopic & related surgery : official publication of the Arthroscopy Association of North America and the International Arthroscopy Association,8506498,IM,"Humans, *Anterior Cruciate Ligament Reconstruction/methods/adverse effects, *Postoperative Pain/drug therapy/prevention & control, Female, Male, *Analgesics, Opioid/administration & dosage/therapeutic use, Adult, *Arthroscopy/methods, Injections, Intra-Articular, Prospective Studies, Pain Measurement, Middle Aged, Hamstring Tendons/transplantation, Intraoperative Care/methods, Young Adult, Anterior Cruciate Ligament Injuries/surgery",,,"Disclosures All authors (H-H.M., K-H.C., E-R.C., H.-L.M.) declare that they have, no known competing financial interests or personal relationships that could have, appeared to influence the work reported in this paper.",2025/03/15 00:38,2025/10/25 00:30,2025/03/14 20:14,"2024/10/14 00:00 [received], 2025/02/28 00:00 [revised], 2025/03/02 00:00 [accepted], 2025/10/25 00:30 [medline], 2025/03/15 00:38 [pubmed], 2025/03/14 20:14 [entrez]","S0749-8063(25)00170-7 [pii], 10.1016/j.arthro.2025.03.014 [doi]",ppublish,Arthroscopy. 2025 Oct;41(10):4095-4102. doi: 10.1016/j.arthro.2025.03.014. Epub 2025 Mar 12.,"Copyright (c) 2025 Arthroscopy Association of North America. Published by Elsevier, Inc. All rights reserved.",,,,"0 (Analgesics, Opioid)",,,,,,,,,
39810716,NLM,MEDLINE,20250628,20250709,1433-7347 (Electronic) 0942-2056 (Linking),33,7,2025 Jul,Kneeling tolerance when using quadriceps tendon autograft for anterior cruciate ligament reconstruction is superior to hamstring tendon autograft.,2390-2396,10.1002/ksa.12583 [doi],"PURPOSE: To investigate kneeling tolerance in patients undergoing hamstring (HT) versus quadriceps (QT) anterior cruciate ligament reconstruction (ACLR) and investigate correlation with patient-reported outcome measures (PROMs). METHODS: After recruitment and randomisation, 112 patients (HT = 55; QT = 57) underwent ACLR. Patients were assessed at 6, 12 and 24 months using the Kneeling Tolerance Test, which evaluates patient-reported pain in a position of both 90 (KT90) and 110 (KT110) degrees of knee flexion. PROMs collected included the International Knee Documentation Committee (IKDC) questionnaire and the ACL Return to Sport after Injury (ACL-RSI) questionnaire. RESULTS: Kneeling tolerance at KT90 and KT110 improved (p < 0.05) for both graft types across all time points. There was no difference in KT90 scores between groups at 6 or 12 months. At 24 months, kneeling tolerance was superior in the QT group (mean HT 93 +/- 9 vs. QT 98 +/- 5; p = 0.003). For KT110 scores, a statistically significant difference was noted at 6 (mean HT 80 +/- 25 vs. QT 89 +/- 12; p = 0.027), 12 (mean HT 90 +/- 13 vs. QT 95 +/- 10; p = 0.040) and 24 months (mean HT 92 +/- 10 vs. QT 97 +/- 5; p = 0.003). The ACL-RSI was significantly correlated with KT90 and KT110 at 24 months (r = 0.40, p < 0.001; r = 0.40, p < 0.001). Other PROMs demonstrated significant weak-to-moderate correlations with kneeling tolerance. CONCLUSION: Patients undergoing ACLR with a QT versus HT autograft report superior kneeling tolerance up to 2 years postsurgery, more prominent in deeper (110 degrees ) knee flexion. A strong correlation with ACL-RSI was demonstrated at 2 years. REGISTRATION: ACTRN12618001520224p (Australian New Zealand Clinical Trials Registry). LEVEL OF EVIDENCE: Level 1.","Calvert, Nicholas D, Ebert, Jay R, Radic, Ross","Calvert ND, Ebert JR, Radic R",ORCID: 0000-0002-1232-8631,"School of Human Sciences (Exercise and Sport Science), University of Western Australia, Crawley, Western Australia, Australia., Perth Orthopaedic & Sports Medicine Research Institute, West Perth, Western Australia, Australia., Department of Orthopaedics, Royal Perth Hospital, Perth, Australia., Perth Orthopaedic & Sports Medicine Centre, Perth, Western Australia, Australia., School of Human Sciences (Exercise and Sport Science), University of Western Australia, Crawley, Western Australia, Australia., Perth Orthopaedic & Sports Medicine Research Institute, West Perth, Western Australia, Australia., HFRC Rehabilitation Clinic, Nedlands, Western Australia, Australia., Perth Orthopaedic & Sports Medicine Research Institute, West Perth, Western Australia, Australia., Department of Orthopaedics, Royal Perth Hospital, Perth, Australia., Perth Orthopaedic & Sports Medicine Centre, Perth, Western Australia, Australia., School of Medicine, University of Western Australia, Crawley, Western Australia, Australia.",eng,"Journal Article, Randomized Controlled Trial",20250115,Germany,Knee Surg Sports Traumatol Arthrosc,"Knee surgery, sports traumatology, arthroscopy : official journal of the ESSKA",9314730,IM,"Humans, *Anterior Cruciate Ligament Reconstruction/methods, Male, Female, *Hamstring Tendons/transplantation, Adult, *Quadriceps Muscle/transplantation, *Anterior Cruciate Ligament Injuries/surgery, Patient Reported Outcome Measures, Young Adult, Transplantation, Autologous, Autografts, Return to Sport, Range of Motion, Articular, Adolescent, *Tendons/transplantation, *Knee Joint/physiopathology",NOTNLM,"anterior cruciate ligament reconstruction, hamstrings autograft, kneeling, quadriceps autograft",,2025/01/15 06:21,2025/07/01 07:06,2025/01/15 04:23,"2025/01/02 00:00 [revised], 2024/11/04 00:00 [received], 2025/01/02 00:00 [accepted], 2025/07/01 07:06 [medline], 2025/01/15 06:21 [pubmed], 2025/01/15 04:23 [entrez]",10.1002/ksa.12583 [doi],ppublish,Knee Surg Sports Traumatol Arthrosc. 2025 Jul;33(7):2390-2396. doi: 10.1002/ksa.12583. Epub 2025 Jan 15.,"(c) 2025 European Society of Sports Traumatology, Knee Surgery and Arthroscopy.","2019-75/International Society of Arthroscopy, Knee Surgery and Orthopaedic Sports, Medicine (ISAKOS)/",,,,,,,,,,,,
39714511,NLM,MEDLINE,20241223,20260102,1434-3916 (Electronic) 0936-8051 (Print) 0936-8051 (Linking),145,1,2024 Dec 23,5-years outcomes following arthroscopic anterior cruciate ligament reconstruction comparing quadruple hamstring and peroneus longus tendon autografts: a randomized control trial.,85,10.1007/s00402-024-05639-1 [doi] 85,"AIMS: This study presents clinical outcomes, functional results, and return to sports after anterior cruciate ligament (ACL) reconstruction using quadruple hamstring tendon autograft or peroneus longus tendon autograft in a randomized controlled trial. PATIENTS AND METHODS: Between February 2018 and July 2019, patients who underwent ACL reconstruction were randomly assigned to two groups: hamstring and peroneus longus. Patient related outcome measurements and pain intensity were evaluated using IKDC, Lysholm, and visual analog scores at 3 and 6 months, 1, 2, and 5 years after the surgery. At the 5 year follow-up, anterior stability was tested using the 3D printable Knee Arthrometer. In addition, in the peroneus longus group, ankle functional assessment was performed using the American foot and ankle score. Additionally, data on the return to sports/activities was collected for both groups at the last follow-up. RESULTS: Sixty patients, with 30 in the hamstring group and 30 in the peroneus group, were included in the study. Patients were predominately male and with low activity demands. After five years of follow-up, there was no significant difference in functional assessment scores (IKDC and Lysholm) between the two groups (P n.s). The median graft diameter was 7.9 +/- 0.4 mm in the hamstring tendon group and 8.9 +/- 0.2 mm in the PL group (P < 0.001). The improvement in Arthrometer testing measurements (AMT) for the operated knees in the hamstring and peroneus longus groups were similar. In the peroneus longus group, the mean postoperative foot and ankle score was 98.6 +/- 3.9 (range = 85-100). CONCLUSION: Using Peroneus longus tendon autograft for arthroscopic ACL reconstruction is a feasible alternative as studied in this cohort of predominately male patients with low activity demands. The graft diameter in this study was sufficient, and the results regarding laxity and patient related outcome measurements were similar to those achieved with hamstring tendon autografts. LEVEL OF EVIDENCE: Level I TRIAL REGISTRATION: ChiCTR2000036989.","Butt, Umer, Vuletic, Filip, Shaikh, M Ali Ahmed, Amanullah, Rehman, Ghufran Ur, Shah, Imran Ali, Stalman, Anders, Khan, Zainab Aqeel","Butt U, Vuletic F, Shaikh MAA, Amanullah, Rehman GU, Shah IA, Stalman A, Khan ZA",ORCID: 0000-0002-6261-2024,"Department of Trauma and Orthopaedic, AO Hospital, Karachi, Pakistan., Sulis Hospital Bath, Bath, UK., University Hospital ""Sveti Duh"", Zagreb, Croatia., Faculty of Kinesiology, University of Zagreb, Zagreb, Croatia., Department of Trauma and Orthopaedic, AO Hospital, Karachi, Pakistan., Department of Trauma and Orthopaedic, AO Hospital, Karachi, Pakistan., Department of Orthopaedic Surgery, Hayatabad Medical Complex, Peshawar, Pakistan., Department of Trauma and Orthopaedic, AO Hospital, Karachi, Pakistan., Dalian Medical University, Dalian, China., Department of Trauma and Orthopaedic, AO Hospital, Karachi, Pakistan., Department of Molecular Medicine and Surgery, Stockholm Sports Trauma Research Center, Karolinska Institutet, Valhallavagen 91, Stockholm, Sweden. anders.stalman@ki.se., Capio Artro Clinic Sophiahemmet Private Hospital, Stockholm, Sweden. anders.stalman@ki.se., Department of Trauma and Orthopaedic, AO Hospital, Karachi, Pakistan., Department of Orthopaedics, Kantonsspital Baselland, Basel, Switzerland., Department of Molecular Medicine and Surgery, Stockholm Sports Trauma Research Center, Karolinska Institutet, Valhallavagen 91, Stockholm, Sweden.",eng,"Comparative Study, Journal Article, Randomized Controlled Trial",20241223,Germany,Arch Orthop Trauma Surg,Archives of orthopaedic and trauma surgery,9011043,IM,"Humans, *Anterior Cruciate Ligament Reconstruction/methods, Male, Female, Adult, *Autografts, *Hamstring Tendons/transplantation, *Tendons/transplantation, Young Adult, Arthroscopy/methods, Anterior Cruciate Ligament Injuries/surgery, Transplantation, Autologous/methods, Treatment Outcome, Return to Sport",NOTNLM,"ACL reconstruction, Autograft, Hamstring autograft, Peroneus longus, Sports injury, Sports surgery","Declarations. Conflict of interest: The authors have no competing interests to, declare that are relevant to the content of this article. Ethical approval: The, ethical approval was obtained from United medical and dental college (board, (UMDC/Ethics/2016/15/06/391). Patient consent: The informed consent was taken, from all patients before enrolment in the study. Clinical trial registration: The, trial was registered in the Chinese clinical trial registry with the registration, number ChiCTR2000036989.",2024/12/23 12:21,2024/12/23 12:22,2024/12/23 11:05,"2024/08/03 00:00 [received], 2024/10/29 00:00 [accepted], 2024/12/23 12:22 [medline], 2024/12/23 12:21 [pubmed], 2024/12/23 11:05 [entrez], 2024/12/23 00:00 [pmc-release]","10.1007/s00402-024-05639-1 [pii], 5639 [pii], 10.1007/s00402-024-05639-1 [doi]",epublish,Arch Orthop Trauma Surg. 2024 Dec 23;145(1):85. doi: 10.1007/s00402-024-05639-1.,(c) 2024. The Author(s).,,PMC11666688,2024/12/23,,,,,,,,,,
