PMID,OWN,STAT,DCOM,LR,IS,VI,IP,DP,TI,PG,LID,AB,FAU,AU,AUID,AD,LA,PT,DEP,PL,TA,JT,JID,SB,MH,OTO,OT,COIS,EDAT,MHDA,CRDT,PHST,AID,PST,SO,CI,GR,PMC,PMCR,RN,SI,CN,CIN,FIR,IR,EIN,TT,MID,RIN
18230264,NLM,MEDLINE,20080415,20221207,0300-0605 (Print) 0300-0605 (Linking),36,1,2008 Jan-Feb,Comparison of short-term results of bone tunnel enlargement between EndoButton CL and cross-pin fixation systems after chronic anterior cruciate ligament reconstruction with autologous quadrupled hamstring tendons.,23-30,,"We performed arthroscopic anterior cruciate ligament (ACL) reconstructions of chronic ACL rupture with autologous hamstring tendon grafts in males (mean age 23.9 years). Thirty-two cross-pin fixations and 24 EndoButton CL fixations were performed on the femoral side. Distal fixations on the tibial side were maintained with interference screws plus a staple. Tunnel enlargement was evaluated using X-rays. Femoral and tibial tunnels were measured at three levels 5 mm apart, and average enlargement was calculated after correction for magnification. Tunnel enlargement 12 months after surgery was greater for the EndoButton CL system (femoral side 43.71%, tibial side 51.11%) than for the cross-pin system (femoral side 32.61%, tibial side 25.62%); the difference was significant only on the tibial side. Both proximal fixation techniques were judged clinically successful (follow-up 16 - 36 months). The far fixation point in the EndoButton CL group may be related to mechanical loosening.","Kuskucu, S M",Kuskucu SM,,"Department of Orthopaedics and Traumatology, GATA Haydarpasa Training Hospital, Istanbul, Turkey. mesih@kuskucu.com",eng,"Comparative Study, Journal Article, Randomized Controlled Trial",,England,J Int Med Res,The Journal of international medical research,0346411,IM,"Adult, Anterior Cruciate Ligament/diagnostic imaging/*surgery, Anterior Cruciate Ligament Injuries, *Arthroscopy, Bone Nails, Follow-Up Studies, Humans, *Internal Fixators, Knee Injuries/diagnostic imaging/*surgery, Male, Radiography, Plastic Surgery Procedures/instrumentation/*methods, Tendons/*transplantation, Tibia/diagnostic imaging/*surgery, Transplantation, Autologous, Treatment Outcome",,,,2008/01/31 09:00,2008/04/16 09:00,2008/01/31 09:00,"2008/01/31 09:00 [pubmed], 2008/04/16 09:00 [medline], 2008/01/31 09:00 [entrez]",10.1177/147323000803600104 [doi],ppublish,J Int Med Res. 2008 Jan-Feb;36(1):23-30. doi: 10.1177/147323000803600104.,,,,,,,,,,,,,,
18212347,NLM,MEDLINE,20080522,20221207,1552-3365 (Electronic) 0363-5465 (Linking),36,4,2008 Apr,"Postoperative range of motion following anterior cruciate ligament reconstruction using autograft hamstrings: a prospective, randomized clinical trial of early versus delayed reconstructions.",656-62,10.1177/0363546507312164 [doi],"BACKGROUND: There is a common belief that surgical reconstruction of an acutely torn anterior cruciate ligament (ACL) should be delayed for at least 3 weeks because of the increased incidence of postoperative motion loss (arthrofibrosis) and suboptimal clinical results. HYPOTHESIS: There is no difference in postoperative range of motion or stability after ACL reconstructions performed either acutely or delayed. STUDY DESIGN: Randomized controlled trial; Level of evidence, 1. METHODS: Patients with an acute ACL tear were prospectively randomized to either early (within 21 days) or delayed (beyond 6 weeks) reconstruction using autograft hamstring tendon. Previous knee surgery on the index extremity and a multiligamentous injury were exclusionary criteria. Surgical technique and postoperative rehabilitation were identical for all patients. Postoperative assessments included range of motion and KT-1000 arthrometer measurements compared with the contralateral knee. Standardized outcome measures were used including single assessment numeric evaluation (SANE), Lysholm, and Tegner Activity Score. RESULTS: Seventy consecutive patients were enrolled, and 1 patient was dropped after a postoperative infection. Sixty-nine patients (34 acute, 35 delayed) with an average age of 27 years composed the study cohort. The mean time from injury to surgery was 9 days (range, 2-17 days) for patients in the early group and 85 days (range, 42-192) for those in the delayed group. The average follow-up from surgery was 366 days (range, 185-869). Articular cartilage and meniscal injuries were comparable between the 2 groups. There were no significant differences between the 2 treatment groups in degrees of extension or flexion lost relative to the nonoperative side, operative time, KT-1000 arthrometer differences, or subjective knee evaluations. CONCLUSION: Excellent clinical results can be achieved after ACL reconstructions performed soon after injury using autograft hamstrings. Although the authors do not advocate that all reconstructions should be performed acutely, they found that early ACL reconstructions do not result in loss of motion or suboptimal clinical results as long as a rehabilitation protocol emphasizing extension and early range of motion is employed.","Bottoni, Craig R, Liddell, Travis R, Trainor, Timothy J, Freccero, David M, Lindell, Kenneth K","Bottoni CR, Liddell TR, Trainor TJ, Freccero DM, Lindell KK",,"Aspetar Orthopaedic & Sports Medicine Hospital, Doha, Qatar. craig.bottoni@aspetar.com",eng,"Journal Article, Randomized Controlled Trial, Research Support, Non-U.S. Gov't",20080122,United States,Am J Sports Med,The American journal of sports medicine,7609541,IM,"Adolescent, Adult, Anterior Cruciate Ligament/*surgery, Anterior Cruciate Ligament Injuries, Female, Humans, Knee Injuries/*surgery, Male, Postoperative Period, Prospective Studies, Range of Motion, Articular/*physiology, *Plastic Surgery Procedures, Time Factors",,,,2008/01/24 09:00,2008/05/23 09:00,2008/01/24 09:00,"2008/01/24 09:00 [pubmed], 2008/05/23 09:00 [medline], 2008/01/24 09:00 [entrez]","0363546507312164 [pii], 10.1177/0363546507312164 [doi]",ppublish,Am J Sports Med. 2008 Apr;36(4):656-62. doi: 10.1177/0363546507312164. Epub 2008 Jan 22.,,,,,,,,,,,,,,
18193194,NLM,MEDLINE,20081007,20220321,0942-2056 (Print) 0942-2056 (Linking),16,3,2008 Mar,Reconstruction of the ACL with a semitendinosus tendon graft: a prospective randomized single blinded comparison of double-bundle versus single-bundle technique in male athletes.,232-8,10.1007/s00167-007-0480-z [doi],"Anterior cruciate ligament (ACL) reconstruction in double-bundle technique is advocated to more closely restore the anatomy and function of the native ligament than conventional single-bundle technique. But up to now there are only a few clinical investigations comparing both techniques in a prospective manner. We hypothesized that double-bundle ACL reconstruction reveals superior clinical and subjective results compared to single-bundle technique in a high-demand collective. A total of 50 male patients (mean age 29.4 years) were prospectively randomized consecutively into one of the two reconstruction techniques. Group 1 (SB) underwent a 4-stranded single-bundle reconstruction with a ST graft in femoral position at 10:00 and 02:00 o'clock, respectively. In group 2 (DB), reconstruction was performed by using a 2-stranded ST graft with double-bundle, four tunnel technique. Before surgery and at a 2 year follow-up (range 23-25 months) patients were evaluated by the same blinded observer. There was no significant difference in the side-to-side anterior laxity-measurement with the KT-1000 between both groups. As evaluated by the pivot shift, no significant correlation could be noted (Fisher exact test P = 0.098) between rotational stability and any of the both reconstruction techniques. However, the anterior and rotational stability improved significantly at 2-year follow-up compared to preoperatively (P = 0.003) in both groups. The statistical analysis showed a significant increase for the IKDC (subjective, objective) and the Lysholm Score at final follow-up among each single technique, while we found no significant difference between the two reconstruction methods. On the basis of our investigation, we conclude that reconstruction of the ACL by a double-bundle ST graft with an extracortical anchorage can achieve excellent clinical results. But in contrast to our initial hypothesis, we could not quote any significant advantages by creating two independent bundles. Reconstruction of the anterior cruciate ligament in conventional single-bundle technique with a more horizontal femoral tunnel placement obtains comparable clinical results in the present high-demand collective.","Streich, Nikolaus A, Friedrich, Kilian, Gotterbarm, Tobias, Schmitt, Holger","Streich NA, Friedrich K, Gotterbarm T, Schmitt H",,"Department of Orthopaedic Sports Medicine, University of Heidelberg, Schlierbacher Landstrasse 200a, 69118 Heidelberg, Germany. nikolaus.streich@ok.uni-heidelberg.de",eng,"Journal Article, Randomized Controlled Trial",20080112,Germany,Knee Surg Sports Traumatol Arthrosc,"Knee surgery, sports traumatology, arthroscopy : official journal of the ESSKA",9314730,IM,"Adolescent, Adult, Anterior Cruciate Ligament/*surgery, Anterior Cruciate Ligament Injuries, Athletic Injuries/*surgery, Follow-Up Studies, Humans, Male, Orthopedic Procedures/*methods, Recovery of Function, Transplantation, Autologous, Transplants",,,,2008/01/15 09:00,2008/10/08 09:00,2008/01/15 09:00,"2007/10/19 00:00 [received], 2007/12/18 00:00 [accepted], 2008/01/15 09:00 [pubmed], 2008/10/08 09:00 [medline], 2008/01/15 09:00 [entrez]",10.1007/s00167-007-0480-z [doi],ppublish,Knee Surg Sports Traumatol Arthrosc. 2008 Mar;16(3):232-8. doi: 10.1007/s00167-007-0480-z. Epub 2008 Jan 12.,,,,,,,,,,,,,,
18192495,NLM,MEDLINE,20080522,20260128,1552-3365 (Electronic) 0363-5465 (Linking),36,4,2008 Apr,Absorption of dexamethasone sodium phosphate in human connective tissue using iontophoresis.,753-9,10.1177/0363546507311597 [doi],"BACKGROUND: Iontophoresis ostensibly facilitates the delivery of medications through the skin to underlying tissues using a direct electrical current. Dexamethasone is the most commonly used medication with iontophoresis to treat a variety of connective tissue disorders. HYPOTHESIS: Iontophoresis will facilitate the absorption of dexamethasone into connective tissue compared with diffusion. STUDY DESIGN: Controlled laboratory study. METHODS: Twenty-nine adults undergoing anterior cruciate ligament reconstructive surgery using the semitendinosus/gracilis autograft were randomly assigned to either a true iontophoresis (TI) or sham iontophoresis (SI). In the TI group, a 40-mA/min dose of iontophoresis using a 0.4% (4 mg/mL) solution of dexamethasone was used targeting the semitendinosus tendon just before surgery. The SI group underwent the same treatment, but the machine was not turned on. Tissue was extracted within 4 hours of treatment and analyzed for dexamethasone. In addition, 2 control samples were sent to the laboratory for analysis. RESULTS: There was a statistically significant difference in dexamethasone concentrations between the groups (P = .0216). Of the 16 samples in the TI group, 8 had measurable amounts of dexamethasone, with an average concentration of 2.906 ng/g of tendon tissue. In the SI group, 1 of the 13 samples had measurable amounts of dexamethasone with an average concentration of 0.205 ng/g of tendon tissue. The control samples contained no dexamethasone. CONCLUSION: Iontophoresis facilitates the transmission of dexamethasone to connective tissues in humans. CLINICAL RELEVANCE: Iontophoresis can deliver dexamethasone to connective tissues in humans.","Gurney, A Burke, Wascher, Daniel C","Gurney AB, Wascher DC",,"University of New Mexico School of Medicine, Department of Orthopaedics and Rehabilitation, Albuquerque, New Mexico, USA. bgurney@salud.unm.edu",eng,"Journal Article, Randomized Controlled Trial, Research Support, Non-U.S. Gov't",20080111,United States,Am J Sports Med,The American journal of sports medicine,7609541,IM,"Adult, Anterior Cruciate Ligament/surgery, Anti-Inflammatory Agents/*administration & dosage/metabolism, Connective Tissue/*physiology, Dexamethasone/administration & dosage/*analogs & derivatives/metabolism, Humans, *Iontophoresis/instrumentation, New Mexico, *Skin Absorption, Tendons/transplantation",,,,2008/01/15 09:00,2008/05/23 09:00,2008/01/15 09:00,"2008/01/15 09:00 [pubmed], 2008/05/23 09:00 [medline], 2008/01/15 09:00 [entrez]","0363546507311597 [pii], 10.1177/0363546507311597 [doi]",ppublish,Am J Sports Med. 2008 Apr;36(4):753-9. doi: 10.1177/0363546507311597. Epub 2008 Jan 11.,,,,,"0 (Anti-Inflammatory Agents), 2BP70L44PR (dexamethasone 21-phosphate), 7S5I7G3JQL (Dexamethasone)",,,,,,,,,
18063177,NLM,MEDLINE,20071220,20221207,1526-3231 (Electronic) 0749-8063 (Linking),23,12,2007 Dec,"Does the position of the femoral tunnel affect the laxity or clinical outcome of the anterior cruciate ligament-reconstructed knee? A clinical, prospective, randomized, double-blind study.",1326-33,,"PURPOSE: The aim of this study was to evaluate whether a change in the femoral graft insertion site between the 1-o'clock (high) and 2-o'clock (low) positions could change the laxity, the score on the 2000 International Knee Documentation Committee (IKDC) Knee Examination Form, or the score on the 2000 subjective IKDC Knee Evaluation Form in the anterior cruciate ligament (ACL)-reconstructed knee. METHODS: The study was designed as a prospective, randomized, double-blind investigation. We randomized 30 patients to the low tunnel position group and 30 to the high tunnel position group. Four-stranded semitendinosus and gracilis single-bundle grafts were used. At follow-up, the patients were examined according to the IKDC evaluation form and the IKDC examination form. The exact measurements of laxity at 25 degrees and 70 degrees were performed by use of the Rolimeter (Aircast, Boca Raton, FL). Standardized radiographs were evaluated. RESULTS: In total, 26 patients in the low tunnel position group and 25 in the high tunnel position group completed the study. At follow-up, we found no significant difference in the laxity at 25 degrees and 70 degrees or scores on the IKDC examination form. We found a significant difference in the scores on the IKDC evaluation form, favoring the low position, with a subjective score of 82.8 versus 70.4. CONCLUSIONS: A change in the femoral tunnel placement from 1 o'clock to 2 o'clock did not result in a detectable change in the sagittal laxity at 25 degrees and 70 degrees , on the pivot-shift test, or on the IKDC examination form scores. However, we found a significant difference between the two groups in the scores on the IKDC evaluation form, most evident in the subgroups dealing with the patient's subjective knee stability. We conclude that it is possible to improve the clinical result in 1-bundle ACL reconstruction by lowering the tibial tunnel angle and thereby lowering the femoral tunnel toward the 2-o'clock position. LEVEL OF EVIDENCE: Level I, therapeutic prospective randomized trial.","Jepsen, Claus Fink, Lundberg-Jensen, Allan Kai, Faunoe, Peter","Jepsen CF, Lundberg-Jensen AK, Faunoe P",,"Randers Central Hospital, Randers, Denmark. fink@dadlnet.dk",eng,"Journal Article, Multicenter Study, Randomized Controlled Trial",,United States,Arthroscopy,Arthroscopy : the journal of arthroscopic & related surgery : official publication of the Arthroscopy Association of North America and the International Arthroscopy Association,8506498,IM,"Adult, Anterior Cruciate Ligament/surgery, *Anterior Cruciate Ligament Injuries, Double-Blind Method, Female, Femur/*surgery, Follow-Up Studies, Humans, Joint Instability/*etiology/physiopathology/surgery, Knee Injuries/complications/physiopathology/*surgery, Male, Muscle, Skeletal/*transplantation, Orthopedic Procedures/*methods, Prospective Studies, Range of Motion, Articular, Plastic Surgery Procedures/*methods, Rupture, Treatment Outcome",,,,2007/12/08 09:00,2007/12/21 09:00,2007/12/08 09:00,"2007/06/05 00:00 [received], 2007/09/27 00:00 [revised], 2007/09/28 00:00 [accepted], 2007/12/08 09:00 [pubmed], 2007/12/21 09:00 [medline], 2007/12/08 09:00 [entrez]","S0749-8063(07)00937-1 [pii], 10.1016/j.arthro.2007.09.010 [doi]",ppublish,Arthroscopy. 2007 Dec;23(12):1326-33. doi: 10.1016/j.arthro.2007.09.010.,,,,,,,,,,,,,,
17934715,NLM,MEDLINE,20080904,20220318,0942-2056 (Print) 0942-2056 (Linking),16,4,2008 Apr,Arthroscopic ACL reconstruction with Delta plasty: an innovative approach with hamstrings' transfer and double tibial tunnel.,420-6,,"We propose a new technique, with double bundle, double tibial tunnels with a bridge between them, using the hamstrings as auto-grafts, retaining either their central or peripheral attachment. A prospective series of 41 patients underwent primary reconstruction of the anterior cruciate ligament by one surgeon, arthroscopically and electronically assisted; 37 were men and 4 were women with a mean age of 24.7 years. The mean follow-up was 19.05 (12-30) months. Normal function and joint stability was achieved. The patients returned to full occupational activities within 3-6 months after the operation. The function of hamstrings was not disturbed. Two patients have sustained a new injury without rupture of the grafts. The Noulis-Lachman test was negative in 35 knees. Positive Pivot shift, post-operatively, was present in 15.45% of patients. The IKDC score was 84.55. In the proposed ACL reconstruction technique, the two tendons are transferred and used as grafts, with gracillis and semitendinosus retaining their distal and central attachment, respectively; the former superimposed upon the latter while entering the femoral tunnel. The tibial tunnels leave a bone bridge ranging between 12 and 15 mm within the footprints of ACL. The two bundles are tensioned, each at different angle. This configuration imitates both the anatomy and the function of ACL and controls not only the anterior translation, but also the rotatory stability. With this innovative technique, the final outcome is improved, thus being closer to normal, as evidenced from previous experiments and the present prospective series.","Papachristou, George, Sourlas, John, Plessas, Spyros, Papachristou, Konstantinos","Papachristou G, Sourlas J, Plessas S, Papachristou K",,"2nd Department of Orthopaedics, University of Athens, Constantopoulion Hospital, N. Ionia, Greece. gcpapachristou@yahoo.gr",eng,"Journal Article, Randomized Controlled Trial",20071013,Germany,Knee Surg Sports Traumatol Arthrosc,"Knee surgery, sports traumatology, arthroscopy : official journal of the ESSKA",9314730,IM,"Adolescent, Adult, Anterior Cruciate Ligament/*surgery, Anterior Cruciate Ligament Injuries, Arthroscopy/*methods, Bone Screws, Female, Humans, Joint Instability/surgery, Male, Prospective Studies, Sutures, Tendon Transfer/*methods, Tibia/*surgery, Transplantation, Autologous",,,,2007/10/16 09:00,2008/09/05 09:00,2007/10/16 09:00,"2007/07/07 00:00 [received], 2007/09/20 00:00 [accepted], 2007/10/16 09:00 [pubmed], 2008/09/05 09:00 [medline], 2007/10/16 09:00 [entrez]",10.1007/s00167-007-0426-5 [doi],ppublish,Knee Surg Sports Traumatol Arthrosc. 2008 Apr;16(4):420-6. doi: 10.1007/s00167-007-0426-5. Epub 2007 Oct 13.,,,,,,,,,,,,,,
17905952,NLM,MEDLINE,20080117,20220410,0301-620X (Print) 0301-620X (Linking),89,9,2007 Sep,Anterior cruciate ligament reconstruction using autologous double hamstrings: a comparison of standard versus minimal debridement techniques using MRI to assess revascularisation. A randomised prospective study with a one-year follow-up.,1165-71,,"Animal studies have shown that implanted anterior cruciate ligament (ACL) grafts initially undergo a process of revascularisation prior to remodelling, ultimately increasing mechanical strength. We investigated whether minimal debridement of the intercondylar notch and the residual stump of the ruptured ACL leads to earlier revascularisation in ACL reconstruction in humans. We undertook a randomised controlled clinical trial in which 49 patients underwent ACL reconstruction using autologous four-strand hamstring tendon grafts. Randomised by the use of sealed envelopes, 25 patients had a conventional clearance of the intercondylar notch and 24 had a minimal debridement method. Three patients were excluded from the study. All patients underwent MR scanning postoperatively at 2, 6 and 12 months, together with clinical assessment using a KT-1000 arthrometer and International Knee Documentation Committee (IKDC) evaluation. All observations were made by investigators blinded to the surgical technique. Signal intensity was measured in 4 mm diameter regions of interest along the ACL graft and the mid-substance of the posterior cruciate ligament. Our results indicate that minimal debridement leads to earlier revascularisation within the mid-substance of the ACL graft at two months (paired t-test, p = 0.002). There was a significant reduction of mid-substance signal six months after the minimal debridement technique (paired t-test, p = 0.00007). No statistically significant differences were found in tunnel placement, incidence of Cyclops lesions, blood loss, IKDC scores, range of movement or Lachman test between the two groups.","Gohil, S, Annear, P O, Breidahl, W","Gohil S, Annear PO, Breidahl W",,"Perth Orthopaedic and Sports Medicine Centre, 31 Outram Street, West Perth, Western Australia 6005. satgohil@hotmail.com",eng,"Comparative Study, Journal Article, Randomized Controlled Trial",,England,J Bone Joint Surg Br,The Journal of bone and joint surgery. British volume,0375355,IM,"Adolescent, Adult, Anterior Cruciate Ligament/blood supply/*surgery, Anterior Cruciate Ligament Injuries, Arthroscopy/*methods, Debridement/*methods, Female, Follow-Up Studies, Humans, Knee Injuries/diagnosis/physiopathology/*surgery, Magnetic Resonance Imaging, Male, Middle Aged, Prospective Studies, Tendons/*transplantation, Transplantation, Autologous/methods",,,,2007/10/02 09:00,2008/01/18 09:00,2007/10/02 09:00,"2007/10/02 09:00 [pubmed], 2008/01/18 09:00 [medline], 2007/10/02 09:00 [entrez]","89-B/9/1165 [pii], 10.1302/0301-620X.89B9.19339 [doi]",ppublish,J Bone Joint Surg Br. 2007 Sep;89(9):1165-71. doi: 10.1302/0301-620X.89B9.19339.,,,,,,,,,,,,,,
